{
    "318": {
        "etiqueta": "ID00147",
        "agencia": "2347",
        "conta_corrente": "0011-2347-0000809875312",
        "cpf": "516.759.760-90",
        "nome_completo": "ANA MADALENA SILVEIRA ALVES",
        "n_doc_serie": "73258674",
        "orgao_emissor": "SSP",
        "data_emissao": "21/07/2018",
        "data_nascimento": "12/04/1992",
        "nome_mae": "MADALENA COSTA SILVEIRA",
        "nome_pai": "JUNIOR AUGUSTO ALVES",
        "endereco": {
            "logradouro": "AV. CRESCENCIO LISBOA",
            "numero": "986",
            "complemento": "Apto 3",
            "bairro": "BARAUNA",
            "cidade": "BARREIRAS",
            "estado": "BA",
            "cep": "47800-013"
        },
        "text": "Proposta de Abertura de Conta, Contrata\u00e7\u00e3o de Cr\u00e9dito e\nAdes\u00e3o a Produtos e Servi\u00e7os Banc\u00e1rios - Pessoa F\u00edsica\nID00147\nAg\u00eancia N\u00ba\n1234\nConta Corrente 0011-2347-0000809875312\nCondi\u00e7\u00e3o de Movimenta\u00e7\u00e3o da Conta X Individual\nAltera\u00e7\u00e3o cadastral\nAngariador (matr\u00edcula) L\n00098961\nDados B\u00e1sicos do Titular\nCPF\n516.759.760-90\nNome Completo ANA MADALENA SILVEIRA ALVES\nDocumento de Identifica\u00e7\u00e3o CNH CTPS Entidade de Classe Mercosul Passaporte\nProtocolo Refugiado\nRIC RNE\nCIE Guia de Acolhimento ao Menor Registro Nacional Migrat\u00f3rio\nN\u00b0 Documento / N\u00b0 da S\u00e9rie (CTPS)\n73258674 \u00d3rg\u00e3o Emissor SSP\nUF BA\nData de Emiss\u00e3o 21/07/2018 Data de Vcto (passaporte/CNH)\n | Data de Nascimento 12/04/1992 Sexo X F M\nNacionalidade x Brasileira\nNome da M\u00e3e MADALENA COSTA SILVEIRA\nNome do Pai JUNIOR AUGUSTO ALVES\nCidadania\nBRASILEIRA\nDomic\u00edlio fiscal\nBRASIL\nEndere\u00e7os\nEndere\u00e7o Residencial\nRua/Av/P\u00e7a/Estrada AV. CRESCENCIO LISBOA\nN\u00famero\n986 Complemento Apto 3\nBairro BARAUNA\nMunic\u00edpio BARREIRAS\nUF BA\nPa\u00eds BRASIL\n47800-013"
    },
    "108": {
        "etiqueta": "ID00357",
        "agencia": "2964",
        "conta_corrente": "0071-2964-0000798456556",
        "cpf": "096.653.550-23",
        "nome_completo": "LUCIANA TRINDADE CARDOSO",
        "n_doc_serie": "249878615",
        "orgao_emissor": "SSP",
        "data_emissao": "12/12/2021",
        "data_nascimento": "23/06/1997",
        "nome_mae": "AMANDA COSTA TRINDADE",
        "nome_pai": "MARCELO MOREIRA CARDOSO",
        "endereco": {
            "logradouro": "RUA ANDERSON TEIXEIRA",
            "numero": "988",
            "bairro": "CAONZE",
            "cidade": "NOVA IGUACU",
            "estado": "RJ",
            "cep": "13970-190"
        },
        "text": "Proposta de Abertura de Conta, Contrata\u00e7\u00e3o de Cr\u00e9dito e\nAdes\u00e3o a Produtos e Servi\u00e7os Banc\u00e1rios - Pessoa F\u00edsica\nID00357\nAg\u00eancia N\u00ba\n2964\nConta Corrente 0071-2964-0000798456556\nCondi\u00e7\u00e3o de Movimenta\u00e7\u00e3o da Conta X Individual\nAltera\u00e7\u00e3o cadastral\nAngariador (matr\u00edcula) L\n00087238978\nDados B\u00e1sicos do Titular\nCPF\n096.653.550-23\nNome Completo LUCIANA TRINDADE CARDOSO\nDocumento de Identifica\u00e7\u00e3o CNH CTPS Entidade de Classe Mercosul Passaporte\nProtocolo Refugiado\nRIC RNE\nCIE Guia de Acolhimento ao Menor Registro Nacional Migrat\u00f3rio\nN\u00b0 Documento / N\u00b0 da S\u00e9rie (CTPS)\n249878615 \u00d3rg\u00e3o Emissor SSP\nUF RJ\nData de Emiss\u00e3o 12/12/2021 Data de Vcto (passaporte/CNH)\n | Data de Nascimento 23/06/1997 Sexo X F M\nNacionalidade x Brasileira\nNome da M\u00e3e AMANDA COSTA TRINDADE\nNome do Pai MARCELO MOREIRA CARDOSO\nCidadania\nBRASILEIRA\nDomic\u00edlio fiscal\nBRASIL\nEndere\u00e7os\nEndere\u00e7o Residencial\nRua/Av/P\u00e7a/Estrada RUA ANDERSON TEIXEIRA\nN\u00famero\n634 Complemento \nBairro CAONZE\nMunic\u00edpio NOVA IGUACU\nUF RJ\nPa\u00eds BRASIL\n13970-190"
    },
    "965": {
        "etiqueta": "ID00885",
        "agencia": "8875",
        "conta_corrente": "0044-8875-000080874526544",
        "cpf": "010.442.950-07",
        "nome_completo": "CARLOS PRATES SOUZA",
        "n_doc_serie": "78945646",
        "orgao_emissor": "SSP",
        "data_emissao": "05/01/2002",
        "data_nascimento": "13/06/1985",
        "nome_mae": "ANABELLE VIEIRA PRATES",
        "nome_pai": "PEDRO ROSA SOUZA",
        "endereco": {
            "logradouro": "RUA JORGE LIMA",
            "numero": "634",
            "complemento": "Apto 1",
            "bairro": "APARECIDA",
            "cidade": "SANTOS",
            "estado": "SP",
            "cep": "01311-000"
        },
        "text": "Proposta de Abertura de Conta, Contrata\u00e7\u00e3o de Cr\u00e9dito e\nAdes\u00e3o a Produtos e Servi\u00e7os Banc\u00e1rios - Pessoa F\u00edsica\nID00885\nAg\u00eancia N\u00ba\n8875\nConta Corrente 0044-8875-000080874526544\nCondi\u00e7\u00e3o de Movimenta\u00e7\u00e3o da Conta X Individual\nAltera\u00e7\u00e3o cadastral\nAngariador (matr\u00edcula) L\n0009861245\nDados B\u00e1sicos do Titular\nCPF\n010.442.950-07\nNome Completo CARLOS PRATES SOUZA\nDocumento de Identifica\u00e7\u00e3o CNH CTPS Entidade de Classe Mercosul Passaporte\nProtocolo Refugiado\nRIC RNE\nCIE Guia de Acolhimento ao Menor Registro Nacional Migrat\u00f3rio\nN\u00b0 Documento / N\u00b0 da S\u00e9rie (CTPS)\n78945646 \u00d3rg\u00e3o Emissor SSP\nUF SP\nData de Emiss\u00e3o 05/01/2002 Data de Vcto (passaporte/CNH)\n | Data de Nascimento 13/06/1985 Sexo F X M\nNacionalidade x Brasileira\nNome da M\u00e3e ANABELLE VIEIRA PRATES\nNome do Pai PEDRO ROSA SOUZA\nCidadania\nBRASILEIRA\nDomic\u00edlio fiscal\nBRASIL\nEndere\u00e7os\nEndere\u00e7o Residencial\nRua/Av/P\u00e7a/Estrada RUA JORGE LIMA\nN\u00famero\n634 Complemento Apto 1\nBairro APARECIDA\nMunic\u00edpio SANTOS\nUF SP\nPa\u00eds BRASIL\n01311-000"
    }
}